{
  "$schema": "http://json-schema.org/draft-07/schema#",
  "$id": "https://clawrocket.dev/contracts/editorial-room/v0/run_skill.input.schema.json",
  "title": "RunSkillInput",
  "description": "MCP RPC: run_skill input. See EDITORIAL_ROOM_CONTRACT.md §6.1.",
  "type": "object",
  "additionalProperties": false,
  "required": [
    "schema_version",
    "skill_slug",
    "idempotency_key",
    "piece_id",
    "setup_version",
    "target_object",
    "target_revision_id",
    "target_content_hash",
    "params",
    "agent_profile_ids",
    "context"
  ],
  "properties": {
    "schema_version": { "const": "0" },
    "skill_slug": {
      "type": "string",
      "minLength": 1,
      "description": "e.g., 'factory_opus_review', 'factory_point_debate'."
    },
    "idempotency_key": {
      "type": "string",
      "minLength": 1,
      "description": "sha256(user_id|agent_id|skill_slug|target_revision_id|target_content_hash|setup_version|params_canonical_json) per §6.4."
    },
    "piece_id": { "type": "string", "minLength": 1 },
    "setup_version": { "type": "integer", "minimum": 1 },
    "target_object": {
      "type": "object",
      "additionalProperties": false,
      "required": ["kind", "ref"],
      "properties": {
        "kind": { "type": "string", "minLength": 1 },
        "ref": {
          "anyOf": [{ "type": "null" }, { "type": "string", "minLength": 1 }]
        }
      }
    },
    "target_revision_id": {
      "anyOf": [{ "type": "null" }, { "type": "string", "minLength": 1 }],
      "description": "For draft skills."
    },
    "target_content_hash": {
      "anyOf": [{ "type": "null" }, { "type": "string", "minLength": 1 }],
      "description": "For draft skills."
    },
    "params": {
      "type": "object",
      "description": "Skill-specific params (subset of allowed fields per skill)."
    },
    "agent_profile_ids": {
      "type": "array",
      "items": { "type": "string", "minLength": 1 },
      "description": "For multi-LLM skills."
    },
    "context": {
      "anyOf": [
        { "type": "null" },
        { "$ref": "https://clawrocket.dev/contracts/editorial-room/v0/skill_context.schema.json" }
      ],
      "description": "Used by Theme/Topic propose Skills; null for everything else."
    }
  }
}
