{
  "schema_version": "0",
  "skill_slug": "factory_score",
  "idempotency_key": "sha256:idemkey001run_skill_score00000000000000000000000000000000000000",
  "piece_id": "piece_01HXYZ789ABC",
  "setup_version": 7,
  "target_object": {
    "kind": "topic",
    "ref": "topic/ai-impact-on-game-dev-how-embracers-writedown-changed-indie-publishing-terms"
  },
  "target_revision_id": null,
  "target_content_hash": "sha256:topic001hash000000000000000000000000000000000000000000000000000",
  "params": {
    "scoring_pipeline_slug": "scoring_pipeline/gamemakers_default",
    "selected_persona_slugs": [
      "persona/ankit-indie-dev",
      "persona/ravi-studio-lead",
      "persona/mei-publisher"
    ]
  },
  "agent_profile_ids": [],
  "context": null
}
