{
  "schema_version": "0",
  "skill_slug": "factory_adv_cut",
  "idempotency_key": "sha256:idemkey002run_skill_adv_cut00000000000000000000000000000000000",
  "piece_id": "piece_01HXYZ789ABC",
  "setup_version": 7,
  "target_object": {
    "kind": "draft",
    "ref": "draft/01HXYZ789ABC"
  },
  "target_revision_id": "01HXYZREV001AAAAAAAAAAAAAA",
  "target_content_hash": "sha256:rev001aaa00000000000000000000000000000000000000000000000000000000",
  "params": {
    "max_suggestions": 30,
    "categories": [
      "filler",
      "repetition",
      "hedge",
      "weak_verb",
      "tangent",
      "wording",
      "structure",
      "voice_drift"
    ]
  },
  "agent_profile_ids": ["agent/argus"],
  "context": null
}
